Poet,Nature Motif,Quoted Line,What It Signified Then,Present-Day Ecological Reality,Source
William Wordsworth,Rivers,"“These waters, rolling from their mountain-springs…” (*Tintern Abbey*, 1798)","River as sacred, self-renewing force of beauty and reflection.","River Wye, once pristine, now heavily polluted by phosphates and agricultural runoff; algal blooms causing fish deaths. Globally, rivers face droughts, pollution, and water scarcity (WMO 2023).",https://www.wmo.int | https://www.bbc.com/news/science-environment-66541475
John Keats,Pollinators / Bees,"“...later flowers for the bees / Until they think warm days will never cease…” (*To Autumn*, 1819)",Autumnal abundance; harmony between nature’s cycles and human joy.,Global pollinator populations declining; ~75% of food crops depend on pollination. IPBES confirms strong regional declines due to land use and pesticides.,https://www.ipbes.net | https://www.fao.org/pollination/en/
Gerard Manley Hopkins,Trees / Forests,"“All felled, felled, are all felled…” (*Binsey Poplars*, 1879)",Spiritual lament for deforestation; trees as divine beauty.,"Since 1990, ~420 million ha forest lost (FAO). Global tree cover loss 517 million ha since 2001 (Global Forest Watch).",https://www.fao.org | https://www.globalforestwatch.org
Matsuo Bashō,Amphibians / Ponds,“Old pond / a frog jumps in — sound of water.” (1686),"Symbol of quiet vitality, harmony, and presence of life.",~41% of amphibian species threatened (IUCN 2023). Wetlands globally degraded or disappearing due to pollution and habitat loss.,https://www.iucn.org | https://www.nature.com/articles/d41586-023-03036-3
Henry David Thoreau,Seasons / Climate,"Detailed observations of ice-out, bloom, and animal activity (*Walden*, 1854)",Seasonal cycles representing balance and self-reliance.,"Walden Pond now shows 5°F temperature rise; earlier flowering and ice melt (Primack et al., Harvard study). Climate change shifting seasonal rhythms worldwide.",https://harvardforest.fas.harvard.edu | https://www.nature.com/articles/nclimate3433
Li Bai (Li Po),Moon / Night Sky,"“I raise the cup to invite the moon…” (*Drinking Alone under the Moon*, 8th c.)",Celestial companionship; cosmic intimacy.,"~80% of North Americans and 60% of Europeans can no longer see the Milky Way due to light pollution (Falchi et al., Science Advances).",https://advances.sciencemag.org/content/2/6/e1600377
"Romantic Poets (Shelley, Wordsworth, etc.)",Birds / Soundscape,Skylarks and nightingales as voices of transcendence.,Birdsong as symbol of pure joy and divine connection.,3 billion birds lost in North America since 1970 (Science 2019). Freshwater vertebrates declined 83% since 1970 (WWF 2022).,https://www.science.org | https://www.worldwildlife.org
